{
  "name": "serverkit-official",
  "schema_version": 1,
  "updated": "2026-10-13",
  "count": 218,
  "templates": [
    {
      "id": "2fauth",
      "name": "2FAuth",
      "version": "1.0",
      "description": "Web app to manage and generate your two-factor authentication (2FA) codes \u2014 a self-hosted authenticator",
      "icon": "https://serverkit.ai/imgs/template-icons/2fauth.svg",
      "categories": [
        "security",
        "authentication"
      ],
      "sha256": "72d323b125aa5c010a565c6a2803dd9c1d913bc919526b0b95e1af1623306307"
    },
    {
      "id": "activepieces",
      "name": "Activepieces",
      "version": "1.0",
      "description": "Open-source no-code automation platform \u2014 a Zapier alternative with 280+ integrations and AI pieces",
      "icon": "https://serverkit.ai/imgs/template-icons/activepieces.svg",
      "categories": [
        "productivity",
        "automation"
      ],
      "sha256": "6f55e16496ed115aa811056f48a6d2d6a3b9bf4c0f1352c2b5bbf2ddd87a7e57"
    },
    {
      "id": "actualbudget",
      "name": "Actual Budget",
      "version": "1.0",
      "description": "Privacy-first personal budgeting app using envelope budgeting with optional bank sync.",
      "icon": "https://serverkit.ai/imgs/template-icons/actualbudget.svg",
      "categories": [
        "finance",
        "productivity"
      ],
      "sha256": "6643df8a147b014c09fd10d638b40e649bf0f3fda635c7265cb036f988880aa6"
    },
    {
      "id": "adguard-home",
      "name": "AdGuard Home",
      "version": "1.0",
      "description": "Network-wide ad and tracker blocking DNS server with parental controls and per-client settings",
      "icon": "https://serverkit.ai/imgs/template-icons/adguard-home.svg",
      "categories": [
        "networking",
        "security",
        "dns"
      ],
      "sha256": "37e6ea7e263a1567517303392d535da156547039985ec2ac6201eaa84977680a"
    },
    {
      "id": "agentsite",
      "name": "AgentSite",
      "version": "1.0",
      "description": "AI-powered website builder with multi-agent orchestration, deployed straight from its Git repository.",
      "icon": "https://serverkit.ai/imgs/template-icons/agentsite.png",
      "categories": [
        "ai",
        "website",
        "deployment"
      ],
      "sha256": "64cda4b6d78bc5a32e3b9a758a8a174ad3f5463e59705c658c499ebced93ed5c"
    },
    {
      "id": "anythingllm",
      "name": "AnythingLLM",
      "version": "1.0",
      "description": "All-in-one private ChatGPT-style app with built-in RAG, AI agents, and document workspaces.",
      "icon": "https://serverkit.ai/imgs/template-icons/anythingllm.svg",
      "categories": [
        "ai",
        "llm",
        "chat",
        "rag"
      ],
      "sha256": "988a21c1a43e422ce7673614b72d5ab5a17cc9ab36b2b1009cdf997872a194db"
    },
    {
      "id": "apprise-api",
      "name": "Apprise API",
      "version": "1.0",
      "description": "One API to send notifications to 100+ services \u2014 Telegram, Discord, Slack, email, ntfy, and more",
      "icon": "https://serverkit.ai/imgs/template-icons/apprise-api.svg",
      "categories": [
        "notifications",
        "automation"
      ],
      "sha256": "faede296e3afc9882de0b1e123dbb07a7e414bad1b1921ed10bafd162330d313"
    },
    {
      "id": "appsmith",
      "name": "Appsmith",
      "version": "1.0",
      "description": "Open-source low-code platform to build internal tools, admin panels, and dashboards on any datasource",
      "icon": "https://serverkit.ai/imgs/template-icons/appsmith.png",
      "categories": [
        "development",
        "low-code",
        "productivity"
      ],
      "sha256": "e292bd174d07dd30d2c682885c3011c1d991a3911c6e455c398331932bab77e7"
    },
    {
      "id": "audiobookshelf",
      "name": "Audiobookshelf",
      "version": "1.0",
      "description": "Self-hosted server for managing and streaming your audiobooks, podcasts, and ebooks.",
      "icon": "https://serverkit.ai/imgs/template-icons/audiobookshelf.svg",
      "categories": [
        "media",
        "audiobooks"
      ],
      "sha256": "6143abef8a134efa5e5939b1a6e8e8cd74b08705fd611fb886fc270bbf177ce6"
    },
    {
      "id": "authelia",
      "name": "Authelia",
      "version": "4.37",
      "description": "Authentication and authorization server providing 2FA and SSO",
      "icon": "https://serverkit.ai/imgs/template-icons/authelia.png",
      "categories": [
        "security",
        "authentication",
        "sso"
      ],
      "sha256": "b8a52861fe2a00f1c2adc69d2dba6004d8fb1a955e718cce6a0b81b76d74b022"
    },
    {
      "id": "authentik",
      "name": "Authentik",
      "version": "1.0",
      "description": "Open-source identity provider for single sign-on with OIDC, SAML, and LDAP.",
      "icon": "https://serverkit.ai/imgs/template-icons/authentik.svg",
      "categories": [
        "security",
        "identity",
        "sso"
      ],
      "sha256": "dd091686d488fd1f77cc1b3d0653964b11513e1802fdc734383c5b6f0f296fb1"
    },
    {
      "id": "backrest",
      "name": "Backrest",
      "version": "1.0",
      "description": "Web UI and orchestrator for restic \u2014 scheduled, encrypted, deduplicated backups to local or cloud storage",
      "icon": "https://serverkit.ai/imgs/template-icons/backrest.svg",
      "categories": [
        "storage",
        "backup"
      ],
      "sha256": "2912b18b313e94e6e55060ee4bb0790846d7a8dd4afdccaa6fe8215fed71c70b"
    },
    {
      "id": "baikal",
      "name": "Ba\u00efkal",
      "version": "1.0",
      "description": "Lightweight CalDAV and CardDAV server \u2014 sync calendars and contacts across all your devices",
      "icon": "https://serverkit.ai/imgs/template-icons/baikal.svg",
      "categories": [
        "productivity",
        "sync"
      ],
      "sha256": "89046bf5a2480923ed8e8e23b46d6c61e92351a34225eaeadce9b8811a6b529a"
    },
    {
      "id": "baserow",
      "name": "Baserow",
      "version": "1.0",
      "description": "Open-source no-code database and Airtable alternative with real-time collaboration",
      "icon": "https://serverkit.ai/imgs/template-icons/baserow.svg",
      "categories": [
        "database",
        "productivity",
        "low-code"
      ],
      "sha256": "954a94691e2a22dc61e04cdbea263e298cd12fd0fb2efeab5e1945b12ebbe893"
    },
    {
      "id": "bazarr",
      "name": "Bazarr",
      "version": "1.0",
      "description": "Companion to Sonarr and Radarr that downloads and manages subtitles for your media library",
      "icon": "https://serverkit.ai/imgs/template-icons/bazarr.svg",
      "categories": [
        "media",
        "automation"
      ],
      "sha256": "c8cc24670c830427b378b100f453b301464b86a4bf7ba1b441fd925674d8a382"
    },
    {
      "id": "beszel",
      "name": "Beszel",
      "version": "1.0",
      "description": "Lightweight server monitoring hub with historical metrics and alerts.",
      "icon": "https://serverkit.ai/imgs/template-icons/beszel.svg",
      "categories": [
        "monitoring"
      ],
      "sha256": "2d34f2fc39a3a2609ecc8d12eeb83f097645e94b714cefbe0984d019b005d24c"
    },
    {
      "id": "bookstack",
      "name": "BookStack",
      "version": "23.12",
      "description": "Simple, self-hosted platform for organizing and storing information",
      "icon": "https://serverkit.ai/imgs/template-icons/bookstack.png",
      "categories": [
        "productivity",
        "wiki",
        "documentation"
      ],
      "sha256": "e1dd3790545e2712de84434e73441ed5f38caf6032f3888f5bcea9198e95c5e2"
    },
    {
      "id": "caddy",
      "name": "Caddy",
      "version": "2.7",
      "description": "Fast, multi-platform web server with automatic HTTPS",
      "icon": "https://serverkit.ai/imgs/template-icons/caddy.svg",
      "categories": [
        "networking",
        "proxy",
        "ssl"
      ],
      "sha256": "37be1453617878376ecddfd55279a8e2983aa9953a478ca150ba8c0214c32c64"
    },
    {
      "id": "cal-com",
      "name": "Cal.com",
      "version": "1.0",
      "description": "Open-source scheduling infrastructure \u2014 the self-hosted Calendly alternative",
      "icon": "https://serverkit.ai/imgs/template-icons/cal-com.svg",
      "categories": [
        "productivity",
        "scheduling"
      ],
      "sha256": "bb215ccc091ab4883615b65f0ed69445ed79a01f7ff70ea27113c9d4c080ad4b"
    },
    {
      "id": "calibre-web",
      "name": "Calibre-Web",
      "version": "1.0",
      "description": "Clean web interface for browsing, reading, and downloading books from a Calibre ebook library.",
      "icon": "https://serverkit.ai/imgs/template-icons/calibre-web.svg",
      "categories": [
        "media",
        "ebooks",
        "productivity"
      ],
      "sha256": "134c1ba75353593144a50809f78e29aeada3cb1b8d95c383ec95532a678b6663"
    },
    {
      "id": "changedetection",
      "name": "changedetection.io",
      "version": "1.0",
      "description": "Website change detection and monitoring with notifications to 90+ services",
      "icon": "https://serverkit.ai/imgs/template-icons/changedetection.svg",
      "categories": [
        "monitoring",
        "automation"
      ],
      "sha256": "d24250157562a212e064fe404f87065610c34e1a1c49092cf0919ad87c20c224"
    },
    {
      "id": "chatwoot",
      "name": "Chatwoot",
      "version": "1.0",
      "description": "Open-source customer engagement suite with live chat and a shared inbox.",
      "icon": "https://serverkit.ai/imgs/template-icons/chatwoot.svg",
      "categories": [
        "business",
        "support",
        "communication"
      ],
      "sha256": "c236a74c10897be3d2fa23671738d4e0a6b36973e9743aafc6688f7f627153ed"
    },